<?xml version="1.0" encoding="UTF-8"?>
<list xmlns:xsi="http://www.w3.org/2001/XMLSchema-instance" xmlns="http://l2j.org" xsi:schemaLocation="http://l2j.org items.xsd">
	<weapon id="14327" name="Sirra's Blade" type="SWORD" body-part="TWO_HAND" icon="icon.weapon_sirr_blade_i00">
	<!-- For NPC -->
		<restriction freightable="false"/>
		<attributes weight="1300" price="26968400" commission-type="OTHER_ITEM"/>
		<crystal type="A"/>
		<damage radius="40" angle="240"/>
		<consume  soulshots="2" spiritshots="2"/>
		<stats>
			<stat type="pAtk" value="251.0"/>
			<stat type="mAtk" value="121.0"/>
			<stat type="rCrit" value="8.0"/>
			<stat type="pAtkSpd" value="379.0"/>
			<stat type="randomDamage" value="10.0"/>
			<stat type="pAtkRange" value="40.0"/>
		</stats>
	</weapon>

	<weapon id="14328" name="Sword of Ipos" type="TWO_HAND_SWORD" body-part="TWO_HAND" icon="icon.weapon_sword_of_ipos_i00">
	<!-- For NPC -->
		<restriction freightable="false"/>
		<attributes weight="1820" price="26968400" commission-type="OTHER_ITEM"/>
		<crystal type="A"/>
		<damage radius="40" angle="240"/>
		<consume  soulshots="2" spiritshots="2"/>
		<stats>
			<stat type="pAtk" value="305.0"/>
			<stat type="mAtk" value="121.0"/>
			<stat type="rCrit" value="8.0"/>
			<stat type="pAtkSpd" value="325.0"/>
			<stat type="randomDamage" value="10.0"/>
			<stat type="pAtkRange" value="40.0"/>
		</stats>
	</weapon>

	<weapon id="14330" name="Behemoth' Tuning Fork" type="HAMMER" body-part="TWO_HAND" icon="icon.weapon_tuning_fork_of_behemoth_i00">
	<!-- For NPC -->
		<restriction freightable="false"/>
		<attributes weight="1890" price="26968400" commission-type="OTHER_ITEM"/>
		<crystal type="A"/>
		<damage radius="40" angle="240"/>
		<consume  soulshots="2" spiritshots="2"/>
		<stats>
			<stat type="pAtk" value="305.0"/>
			<stat type="mAtk" value="121.0"/>
			<stat type="rCrit" value="6.0"/>
			<stat type="accCombat" value="8.0"/>
			<stat type="pAtkSpd" value="325.0"/>
			<stat type="randomDamage" value="20.0"/>
			<stat type="pAtkRange" value="40.0"/>
		</stats>
	</weapon>

	<weapon id="14331" name="Naga Storm" type="DAGGER" body-part="TWO_HAND" icon="icon.weapon_naga_storm_i00">
	<!-- For NPC -->
		<restriction freightable="false"/>
		<attributes weight="930" price="26968400" commission-type="OTHER_ITEM"/>
		<crystal type="A"/>
		<damage radius="40" angle="240"/>
		<consume  soulshots="2" spiritshots="2"/>
		<stats>
			<stat type="pAtk" value="220.0"/>
			<stat type="mAtk" value="121.0"/>
			<stat type="rCrit" value="12.0"/>
			<stat type="accCombat" value="-3.75"/>
			<stat type="pAtkSpd" value="433.0"/>
			<stat type="randomDamage" value="5.0"/>
			<stat type="pAtkRange" value="80.0"/>
		</stats>
	</weapon>

	<weapon id="14332" name="Tiphon's Spear" type="SPEAR" body-part="TWO_HAND" icon="icon.weapon_tiphon_spear_i00">
	<!-- For NPC -->
		<restriction freightable="false"/>
		<attributes weight="1820" price="26968400" commission-type="OTHER_ITEM"/>
		<crystal type="A"/>
		<damage radius="40" angle="240"/>
		<consume  soulshots="2" spiritshots="2"/>
		<stats>
			<stat type="pAtk" value="251.0"/>
			<stat type="mAtk" value="121.0"/>
			<stat type="rCrit" value="8.0"/>
			<stat type="accCombat" value="-3.75"/>
			<stat type="pAtkSpd" value="325.0"/>
			<stat type="randomDamage" value="10.0"/>
			<stat type="pAtkRange" value="80.0"/>
		</stats>
		<skills>
			<skill id="3599" level="1"/>  <!-- Polearm Multi-attack -->
		</skills>
	</weapon>

	<weapon id="14333" name="Shyeed's Bow" type="BOW" body-part="TWO_HAND" icon="icon.weapon_shyid_bow_i00">
	<!-- For NPC -->
		<restriction freightable="false"/>
		<attributes weight="1640" price="26968400" commission-type="OTHER_ITEM"/>
		<crystal type="A"/>
		<damage radius="40" angle="240"/>
		<consume  soulshots="3" spiritshots="2" mana="5"/>
		<stats>
			<stat type="pAtk" value="570.0"/>
			<stat type="mAtk" value="133.0"/>
			<stat type="rCrit" value="12.0"/>
			<stat type="accCombat" value="-3.75"/>
			<stat type="pAtkSpd" value="227.0"/>
			<stat type="randomDamage" value="5.0"/>
			<stat type="pAtkRange" value="500.0"/>
		</stats>
	</weapon>

	<weapon id="14334" name="Sobekk's Hurricane" type="FIST" body-part="TWO_HAND" icon="icon.weapon_sobekk_hurricane_i00">
	<!-- For NPC -->
		<restriction freightable="false"/>
		<attributes weight="1330" price="26968400" commission-type="OTHER_ITEM"/>
		<crystal type="A"/>
		<damage radius="40" angle="240"/>
		<consume  soulshots="2" spiritshots="2"/>
		<stats>
			<stat type="pAtk" value="305.0"/>
			<stat type="mAtk" value="121.0"/>
			<stat type="rCrit" value="6.0"/>
			<stat type="accCombat" value="8.0"/>
			<stat type="pAtkSpd" value="325.0"/>
			<stat type="randomDamage" value="5.0"/>
			<stat type="pAtkRange" value="40.0"/>
		</stats>
	</weapon>

	<weapon id="14335" name="Themis' Tongue" type="MAGIC_SWORD" body-part="TWO_HAND" icon="icon.weapon_tongue_of_themis_i00" magic="true">
	<!-- For NPC -->
		<restriction freightable="false"/>
		<attributes weight="820" price="26968400" commission-type="OTHER_ITEM"/>
		<crystal type="A"/>
		<damage radius="40" angle="240"/>
		<consume  soulshots="2" spiritshots="2"/>
		<stats>
			<stat type="pAtk" value="202.0"/>
			<stat type="mAtk" value="161.0"/>
			<stat type="rCrit" value="8.0"/>
			<stat type="pAtkSpd" value="379.0"/>
			<stat type="randomDamage" value="10.0"/>
			<stat type="pAtkRange" value="40.0"/>
		</stats>
	</weapon>

	<weapon id="14336" name="Cabrio's Hand" type="ROD" body-part="TWO_HAND" icon="icon.weapon_hand_of_cabrio_i00" magic="true">
	<!-- For NPC -->
		<restriction freightable="false"/>
		<attributes weight="1510" price="26968400" commission-type="OTHER_ITEM"/>
		<crystal type="A"/>
		<damage radius="40" angle="240"/>
		<consume  soulshots="2" spiritshots="2"/>
		<stats>
			<stat type="pAtk" value="202.0"/>
			<stat type="mAtk" value="161.0"/>
			<stat type="rCrit" value="6.0"/>
			<stat type="accCombat" value="8.0"/>
			<stat type="pAtkSpd" value="379.0"/>
			<stat type="randomDamage" value="20.0"/>
			<stat type="pAtkRange" value="40.0"/>
		</stats>
	</weapon>

	<weapon id="14338" name="Tallum Blade*Damascus" type="DUAL" body-part="TWO_HAND" icon="icon.weapon_dual_sword_i00">
	<!-- For NPC -->
		<restriction freightable="false"/>
		<attributes weight="1890" price="26968400" commission-type="OTHER_ITEM"/>
		<crystal type="A"/>
		<damage radius="40" angle="240"/>
		<consume  soulshots="2" spiritshots="2"/>
		<stats>
			<stat type="pAtk" value="305.0"/>
			<stat type="mAtk" value="121.0"/>
			<stat type="rCrit" value="8.0"/>
			<stat type="pAtkSpd" value="325.0"/>
			<stat type="randomDamage" value="10.0"/>
			<stat type="pAtkRange" value="40.0"/>
		</stats>
	</weapon>

	<weapon id="14339" name="Ã‰clair Bijou" type="RAPIER" body-part="RIGHT_HAND" icon="icon.weapon_greed_stinger_i00">
	<!-- For NPC -->
		<restriction freightable="false"/>
		<attributes weight="1300" price="26968400" commission-type="OTHER_ITEM"/>
		<crystal type="A"/>
		<damage radius="40" angle="240"/>
		<consume  soulshots="2" spiritshots="2"/>
		<stats>
			<stat type="pAtk" value="228.0"/>
			<stat type="mAtk" value="121.0"/>
			<stat type="rCrit" value="10.0"/>
			<stat type="accCombat" value="-1.5"/>
			<stat type="pAtkSpd" value="406.0"/>
			<stat type="randomDamage" value="40.0"/>
			<stat type="pAtkRange" value="40.0"/>
		</stats>
	</weapon>

	<weapon id="14341" name="Screaming Vengeance" type="CROSSBOW" body-part="TWO_HAND" icon="icon.weapon_soul_shooter_i00">
	<!-- For NPC -->
		<restriction freightable="false"/>
		<attributes weight="1640" price="26968400" commission-type="OTHER_ITEM"/>
		<crystal type="A"/>
		<damage radius="40" angle="240"/>
		<consume  soulshots="3" spiritshots="2"/>
		<stats>
			<stat type="pAtk" value="318.0"/>
			<stat type="mAtk" value="121.0"/>
			<stat type="rCrit" value="10.0"/>
			<stat type="accCombat" value="-1.5"/>
			<stat type="pAtkSpd" value="303.0"/>
			<stat type="randomDamage" value="10.0"/>
			<stat type="pAtkRange" value="400.0"/>
		</stats>
	</weapon>

	<armor id="14348" name="Majestic Earring" type="NONE" body-part="EAR" icon="icon.accessary_inferno_earing_i00">
	<!-- For NPC -->
		<restriction freightable="false"/>
		<attributes weight="150" price="1498000" />
		<crystal type="A"/>
		<stats>
			<stat type="mDef" value="63.0"/>
			<stat type="maxMp" value="25.0"/>
		</stats>
	</armor>

	<armor id="14349" name="Majestic Ring" type="NONE" body-part="FINGER" icon="icon.accessary_inferno_ring_i00">
	<!-- For NPC -->
		<restriction freightable="false"/>
		<attributes weight="150" price="999000" />
		<crystal type="A"/>
		<stats>
			<stat type="mDef" value="42.0"/>
			<stat type="maxMp" value="17.0"/>
		</stats>
	</armor>

	<armor id="14350" name="Majestic Necklace" type="NONE" body-part="NECK" icon="icon.accessary_inferno_necklace_i00">
	<!-- For NPC -->
		<restriction freightable="false"/>
		<attributes weight="150" price="1998000" />
		<crystal type="A"/>
		<stats>
			<stat type="mDef" value="85.0"/>
			<stat type="maxMp" value="33.0"/>
		</stats>
	</armor>

</list>