<?xml version="1.0" encoding="UTF-8"?>
<list xmlns:xsi="http://www.w3.org/2001/XMLSchema-instance" xmlns="http://l2j.org" xsi:schemaLocation="http://l2j.org ../items.xsd">
    <item id="728" display-id="90310" type="POTION" name="Mana Potion" icon="icon.etc_reagent_blue_i00">
        <!-- Magical, liquid medicine that restores MP for a certain amount of time. -->
        <restriction stackable="true" olympiad-restricted="true"/>
        <condition add-name="true" msg-id="113">
            <player flying="false"/>
        </condition>
        <attributes weight="180" price="2000" commission-type="POTION" for-npc="true" immediate-effect="true"/>
        <skill-reducer type="ItemSkills">
            <skill id="26030" level="1"/>  <!-- Mana Potion -->
        </skill-reducer>
    </item>
</list>
