<?xml version="1.0" encoding="UTF-8"?>
<list xmlns:xsi="http://www.w3.org/2001/XMLSchema-instance" xmlns="http://l2j.org" xsi:schemaLocation="http://l2j.org items.xsd">
	<weapon id="39719" name="Monster only_Crook Staff" type="SPEAR" body-part="TWO_HAND" icon="icon.wp_fishing4">
	<!-- A monster-only weapon. -->
		<restriction freightable="false" destroyable="false" tradable="false" dropable="false" sellable="false" private-sellable="false"/>
		<attributes weight="205" commission-type="OTHER_ITEM" enchant-enabled="false"/>
		<crystal type="D"/>
		<damage radius="40" angle="240"/>
		<consume />
		<stats>
			<stat type="pAtk" value="92.0"/>
			<stat type="mAtk" value="54.0"/>
			<stat type="rCrit" value="8.0"/>
			<stat type="accCombat" value="-3.75"/>
			<stat type="pAtkSpd" value="325.0"/>
			<stat type="randomDamage" value="10.0"/>
			<stat type="pAtkRange" value="80.0"/>
		</stats>
	</weapon>

</list>